code,name,parent_code,level
11,"AGRICULTURE, FORESTRY, FISHING, AND HUNTING",TOTII,1
111CA,Farms,11,2
111,Crop production,111CA,3
1111A0,Oilseed farming,111,4
1111B0,Grain farming,111,4
111200,Vegetable and melon farming,111,4
111300,Fruit and tree nut farming,111,4
111400,"Greenhouse, nursery, and floriculture production",111,4
111900,Other crop farming,111,4
112,Animal production and aquaculture,111CA,3
1121A0,"Beef cattle ranching and farming, including feedlots and dual-purpose ranching and farming",112,4
112120,Dairy cattle and milk production,112,4
112A00,"Animal production, except cattle and poultry and eggs",112,4
112300,Poultry and egg production,112,4
113FF,"Forestry, fishing, and related activities",11,2
113000,Forestry and logging,113FF,3
114000,"Fishing, hunting and trapping",113FF,3
115000,Support activities for agriculture and forestry,113FF,3
21,MINING,TOTII,1
211,Oil and gas extraction,21,2
211000,Oil and gas extraction,211,3
212,"Mining, except oil and gas",21,2
212100,Coal mining,212,3
2122A0,"Iron, gold, silver, and other metal ore mining",212,3
212230,"Copper, nickel, lead, and zinc mining",212,3
212310,Stone mining and quarrying,212,3
2123A0,Other nonmetallic mineral mining and quarrying,212,3
213,Support activities for mining,21,2
213111,Drilling oil and gas wells,213,3
21311A,Other support activities for mining,213,3
22,Utilities,TOTII,1
2211,"Electric power generation, transmission, and distribution",22,2
221100,"Electric power generation, transmission, and distribution",2211,3
2212NW,"Natural gas distribution and water, sewage and other systems",22,2
221200,Natural gas distribution,2212NW,3
221300,"Water, sewage and other systems",2212NW,3
23,Construction,TOTII,1
23EH,"Education, hospital, and health structures",23,2
233210,Health care structures,23EH,3
233262,Educational and vocational structures,23EH,3
23OC,Office and commercial structures,23,2
2332A0,Office and commercial structures,23OC,3
23PC,Power and communication structures,23,2
233240,Power and communication structures,23PC,3
23TH,Transportation structures and highways and streets,23,2
2332C0,Transportation structures and highways and streets,23TH,3
23OT,Other nonresidential structures,23,2
233230,Manufacturing structures,23OT,3
2332D0,Other nonresidential structures,23OT,3
23SF,Single-family residential structures,23,2
233411,Single-family residential structures,23SF,3
23OR,Other residential construction,23,2
233412,Multifamily residential structures,23OR,3
2334A0,Other residential structures,23OR,3
23MR,Maintenance and repair construction,23,2
230301,Nonresidential maintenance and repair,23MR,3
230302,Residential maintenance and repair,23MR,3
33DG,DURABLE GOODS,TOTII,1
321,Wood products,33DG,2
321100,Sawmills and wood preservation,321,3
321200,"Veneer, plywood, and engineered wood product manufacturing",321,3
321910,Millwork,321,3
3219A0,All other wood product manufacturing,321,3
327,Nonmetallic mineral products,33DG,2
327100,Clay product and refractory manufacturing,327,3
327200,Glass and glass product manufacturing,327,3
327310,Cement manufacturing,327,3
327320,Ready-mix concrete manufacturing,327,3
327330,"Concrete pipe, brick, and block manufacturing",327,3
327390,Other concrete product manufacturing,327,3
327400,Lime and gypsum product manufacturing,327,3
327910,Abrasive product manufacturing,327,3
327991,Cut stone and stone product manufacturing,327,3
327992,Ground or treated mineral and earth manufacturing,327,3
327993,Mineral wool manufacturing,327,3
327999,Miscellaneous nonmetallic mineral products,327,3
331,Primary metals,33DG,2
3311IS,Iron and steel mills and manufacturing from purchased steel,331,3
331110,Iron and steel mills and ferroalloy manufacturing,3311IS,4
331200,Steel product manufacturing from purchased steel,3311IS,4
3313NF,Nonferrous metal production and processing and foundries,331,3
331313,Alumina refining and primary aluminum production,3313NF,4
331314,Secondary smelting and alloying of aluminum,3313NF,4
33131B,Aluminum product manufacturing from purchased aluminum,3313NF,4
331410,Nonferrous metal (except aluminum) smelting and refining,3313NF,4
331420,"Copper rolling, drawing, extruding and alloying",3313NF,4
331490,"Nonferrous metal (except copper and aluminum) rolling, drawing, extruding and alloying",3313NF,4
331510,Ferrous metal foundries,3313NF,4
331520,Nonferrous metal foundries,3313NF,4
332,Fabricated metal products,33DG,2
33211A,"All other forging, stamping, and sintering",332,3
332114,Custom roll forming,332,3
332119,"Metal crown, closure, and other metal stamping (except automotive)",332,3
332200,Cutlery and handtool manufacturing,332,3
332310,Plate work and fabricated structural product manufacturing,332,3
332320,Ornamental and architectural metal products manufacturing,332,3
332410,Power boiler and heat exchanger manufacturing,332,3
332420,Metal tank (heavy gauge) manufacturing,332,3
332430,"Metal can, box, and other metal container (light gauge) manufacturing",332,3
332500,Hardware manufacturing,332,3
332600,Spring and wire product manufacturing,332,3
332710,Machine shops,332,3
332720,"Turned product and screw, nut, and bolt manufacturing",332,3
332800,"Coating, engraving, heat treating and allied activities",332,3
33291A,Valve and fittings other than plumbing,332,3
332913,Plumbing fixture fitting and trim manufacturing,332,3
332991,Ball and roller bearing manufacturing,332,3
33299A,"Ammunition, arms, ordnance, and accessories manufacturing",332,3
332996,Fabricated pipe and pipe fitting manufacturing,332,3
332999,Other fabricated metal manufacturing,332,3
333,Machinery,33DG,2
33311,Agricultural implement manufacturing,333,3
333111,Farm machinery and equipment manufacturing,33311,4
333112,Lawn and garden equipment manufacturing,33311,4
33312,Construction machinery manufacturing,333,3
333120,Construction machinery manufacturing,33312,4
33313,Mining and oil and gas field machinery manufacturing,333,3
333130,Mining and oil and gas field machinery manufacturing,33313,4
3332OM,Other machinery,333,3
333242,Semiconductor machinery manufacturing,3332OM,4
33329A,Other industrial machinery manufacturing,3332OM,4
333314,Optical instrument and lens manufacturing,3332OM,4
333316,Photographic and photocopying equipment manufacturing,3332OM,4
333318,Other commercial and service industry machinery manufacturing,3332OM,4
333413,Industrial and commercial fan and blower and air purification equipment manufacturing,3332OM,4
333414,Heating equipment (except warm air furnaces) manufacturing,3332OM,4
333415,"Air conditioning, refrigeration, and warm air heating equipment manufacturing",3332OM,4
333511,Industrial mold manufacturing,3332OM,4
333517,Machine tool manufacturing,3332OM,4
333514,"Special tool, die, jig, and fixture manufacturing",3332OM,4
33351B,"Cutting and machine tool accessory, rolling mill, and other metalworking machinery manufacturing",3332OM,4
333611,Turbine and turbine generator set units manufacturing,3332OM,4
333612,"Speed changer, industrial high-speed drive, and gear manufacturing",3332OM,4
333613,Mechanical power transmission equipment manufacturing,3332OM,4
333618,Other engine equipment manufacturing,3332OM,4
333914,"Measuring, dispensing, and other pumping equipment manufacturing",3332OM,4
333912,Air and gas compressor manufacturing,3332OM,4
333920,Material handling equipment manufacturing,3332OM,4
333991,Power-driven handtool manufacturing,3332OM,4
33399A,Other general purpose machinery manufacturing,3332OM,4
333993,Packaging machinery manufacturing,3332OM,4
333994,Industrial process furnace and oven manufacturing,3332OM,4
33399B,Fluid power process machinery,3332OM,4
334,Computer and electronic products,33DG,2
3341,Computer and peripheral equipment manufacturing,334,3
334111,Electronic computer manufacturing,3341,4
334112,Computer storage device manufacturing,3341,4
334118,Computer terminals and other computer peripheral equipment manufacturing,3341,4
3342,Communications equipment manufacturing,334,3
334210,Telephone apparatus manufacturing,3342,4
334220,Broadcast and wireless communications equipment,3342,4
334290,Other communications equipment manufacturing,3342,4
3344,Semiconductor and other electronic component manufacturing,334,3
334413,Semiconductor and related device manufacturing,3344,4
334418,Printed circuit assembly (electronic assembly) manufacturing,3344,4
33441A,Other electronic component manufacturing,3344,4
3345,"Navigational, measuring, electromedical, and control instruments manufacturing",334,3
334510,Electromedical and electrotherapeutic apparatus manufacturing,3345,4
334511,"Search, detection, and navigation instruments manufacturing",3345,4
334512,Automatic environmental control manufacturing,3345,4
334513,Industrial process variable instruments manufacturing,3345,4
334514,Totalizing fluid meter and counting device manufacturing,3345,4
334515,Electricity and signal testing instruments manufacturing,3345,4
334516,Analytical laboratory instrument manufacturing,3345,4
334517,Irradiation apparatus manufacturing,3345,4
33451A,"Watch, clock, and other measuring and controlling device manufacturing",3345,4
334X,Other computer and electronic product manufacturing,334,3
334300,Audio and video equipment manufacturing,334X,4
334610,Manufacturing and reproducing magnetic and optical media,334X,4
335,"Electrical equipment, appliances, and components",33DG,2
335110,Electric lamp bulb and part manufacturing,335,3
335120,Lighting fixture manufacturing,335,3
335210,Small electrical appliance manufacturing,335,3
335220,Major household appliance manufacturing,335,3
335311,"Power, distribution, and specialty transformer manufacturing",335,3
335312,Motor and generator manufacturing,335,3
335313,Switchgear and switchboard apparatus manufacturing,335,3
335314,Relay and industrial control manufacturing,335,3
335911,Storage battery manufacturing,335,3
335912,Primary battery manufacturing,335,3
335920,Communication and energy wire and cable manufacturing,335,3
335930,Wiring device manufacturing,335,3
335991,Carbon and graphite product manufacturing,335,3
335999,All other miscellaneous electrical equipment and component manufacturing,335,3
3361MV,"Motor vehicles, bodies and trailers, and parts",33DG,2
336111,Automobile manufacturing,3361MV,3
336112,Light truck and utility vehicle manufacturing,3361MV,3
33612,Heavy duty truck manufacturing,3361MV,3
336120,Heavy duty truck manufacturing,33612,4
3362BP,"Motor vehicle body, trailer, and parts manufacturing",3361MV,3
336211,Motor vehicle body manufacturing,3362BP,4
336212,Truck trailer manufacturing,3362BP,4
336213,Motor home manufacturing,3362BP,4
336214,Travel trailer and camper manufacturing,3362BP,4
336310,Motor vehicle gasoline engine and engine parts manufacturing,3362BP,4
336320,Motor vehicle electrical and electronic equipment manufacturing,3362BP,4
3363A0,"Motor vehicle steering, suspension component (except spring), and brake systems manufacturing",3362BP,4
336350,Motor vehicle transmission and power train parts manufacturing,3362BP,4
336360,Motor vehicle seating and interior trim manufacturing,3362BP,4
336370,Motor vehicle metal stamping,3362BP,4
336390,Other motor vehicle parts manufacturing,3362BP,4
3364OT,Other transportation equipment,33DG,2
3364,Aerospace product and parts manufacturing,3364OT,3
336411,Aircraft manufacturing,3364,4
336412,Aircraft engine and engine parts manufacturing,3364,4
336413,Other aircraft parts and auxiliary equipment manufacturing,3364,4
336414,Guided missile and space vehicle manufacturing,3364,4
33641A,Propulsion units and parts for space vehicles and guided missiles,3364,4
3365AO,All other transportation equipment manufacturing,3364OT,3
336500,Railroad rolling stock manufacturing,3365AO,4
336611,Ship building and repairing,3365AO,4
336612,Boat building,3365AO,4
336991,"Motorcycle, bicycle, and parts manufacturing",3365AO,4
336992,"Military armored vehicle, tank, and tank component manufacturing",3365AO,4
336999,All other transportation equipment manufacturing,3365AO,4
337,Furniture and related products,33DG,2
337110,Wood kitchen cabinet and countertop manufacturing,337,3
337121,Upholstered household furniture manufacturing,337,3
337122,Nonupholstered wood household furniture manufacturing,337,3
33712N,Other household nonupholstered furniture,337,3
337127,Institutional furniture manufacturing,337,3
33721A,Office furniture and custom architectural woodwork and millwork manufacturing,337,3
337215,"Showcase, partition, shelving, and locker manufacturing",337,3
337900,Other furniture related product manufacturing,337,3
339,Miscellaneous manufacturing,33DG,2
3391,Medical equipment and supplies manufacturing,339,3
339112,Surgical and medical instrument manufacturing,3391,4
339113,Surgical appliance and supplies manufacturing,3391,4
339114,Dental equipment and supplies manufacturing,3391,4
339115,Ophthalmic goods manufacturing,3391,4
339116,Dental laboratories,3391,4
3399,Other miscellaneous manufacturing,339,3
339910,Jewelry and silverware manufacturing,3399,4
339920,Sporting and athletic goods manufacturing,3399,4
339930,"Doll, toy, and game manufacturing",3399,4
339940,Office supplies (except paper) manufacturing,3399,4
339950,Sign manufacturing,3399,4
339990,All other miscellaneous manufacturing,3399,4
31ND,NONDURABLE GOODS,TOTII,1
311FT,Food and beverage and tobacco products,31ND,2
311,Food manufacturing,311FT,3
311111,Dog and cat food manufacturing,311,4
311119,Other animal food manufacturing,311,4
311210,Flour milling and malt manufacturing,311,4
311221,Wet corn milling,311,4
311224,Soybean and other oilseed processing,311,4
311225,Fats and oils refining and blending,311,4
311230,Breakfast cereal manufacturing,311,4
311300,Sugar and confectionery product manufacturing,311,4
311410,Frozen food manufacturing,311,4
311420,"Fruit and vegetable canning, pickling, and drying",311,4
31151A,Fluid milk and butter manufacturing,311,4
311513,Cheese manufacturing,311,4
311514,"Dry, condensed, and evaporated dairy product manufacturing",311,4
311520,Ice cream and frozen dessert manufacturing,311,4
31161A,"Animal (except poultry) slaughtering, rendering, and processing",311,4
311615,Poultry processing,311,4
311700,Seafood product preparation and packaging,311,4
311810,Bread and bakery product manufacturing,311,4
3118A0,"Cookie, cracker, pasta, and tortilla manufacturing",311,4
311910,Snack food manufacturing,311,4
311920,Coffee and tea manufacturing,311,4
311930,Flavoring syrup and concentrate manufacturing,311,4
311940,Seasoning and dressing manufacturing,311,4
311990,All other food manufacturing,311,4
3121,Beverage manufacturing,311FT,3
312110,Soft drink and ice manufacturing,3121,4
312120,Breweries,3121,4
312130,Wineries,3121,4
312140,Distilleries,3121,4
3122,Tobacco manufacturing,311FT,3
312200,Tobacco manufacturing,3122,4
313TT,Textile mills and textile product mills,31ND,2
313100,"Fiber, yarn, and thread mills",313TT,3
313200,Fabric mills,313TT,3
313300,Textile and fabric finishing and fabric coating mills,313TT,3
314110,Carpet and rug mills,313TT,3
314120,Curtain and linen mills,313TT,3
314900,Other textile product mills,313TT,3
315AL,Apparel and leather and allied products,31ND,2
315000,Apparel manufacturing,315AL,3
316000,Leather and allied product manufacturing,315AL,3
322,Paper products,31ND,2
322110,Pulp mills,322,3
322120,Paper mills,322,3
322130,Paperboard mills,322,3
322210,Paperboard container manufacturing,322,3
322220,Paper bag and coated and treated paper manufacturing,322,3
322230,Stationery product manufacturing,322,3
322291,Sanitary paper product manufacturing,322,3
322299,All other converted paper product manufacturing,322,3
323,Printing and related support activities,31ND,2
323110,Printing,323,3
323120,Support activities for printing,323,3
324,Petroleum and coal products,31ND,2
324110,Petroleum refineries,324,3
324121,Asphalt paving mixture and block manufacturing,324,3
324122,Asphalt shingle and coating materials manufacturing,324,3
324190,Other petroleum and coal products manufacturing,324,3
325,Chemical products,31ND,2
3251,Basic chemical manufacturing,325,3
325110,Petrochemical manufacturing,3251,4
325120,Industrial gas manufacturing,3251,4
325130,Synthetic dye and pigment manufacturing,3251,4
325180,Other basic inorganic chemical manufacturing,3251,4
325190,Other basic organic chemical manufacturing,3251,4
3252,"Resin, rubber, and artificial fibers manufacturing",325,3
325211,Plastics material and resin manufacturing,3252,4
3252A0,Synthetic rubber and artificial and synthetic fibers and filaments manufacturing,3252,4
3254,Pharmaceutical and medicine manufacturing,325,3
325411,Medicinal and botanical manufacturing,3254,4
325412,Pharmaceutical preparation manufacturing,3254,4
325413,In-vitro diagnostic substance manufacturing,3254,4
325414,Biological product (except diagnostic) manufacturing,3254,4
325X,Other chemical manufacturing,325,3
325310,Fertilizer manufacturing,325X,4
325320,Pesticide and other agricultural chemical manufacturing,325X,4
325510,Paint and coating manufacturing,325X,4
325520,Adhesive manufacturing,325X,4
325610,Soap and cleaning compound manufacturing,325X,4
325620,Toilet preparation manufacturing,325X,4
325910,Printing ink manufacturing,325X,4
3259A0,All other chemical product and preparation manufacturing,325X,4
326,Plastics and rubber products,31ND,2
326110,Plastics packaging materials and unlaminated film and sheet manufacturing,326,3
326120,"Plastics pipe, pipe fitting, and unlaminated profile shape manufacturing",326,3
326130,"Laminated plastics plate, sheet (except packaging), and shape manufacturing",326,3
326140,Polystyrene foam product manufacturing,326,3
326150,Urethane and other foam product (except polystyrene) manufacturing,326,3
326160,Plastics bottle manufacturing,326,3
326190,Other plastics product manufacturing,326,3
326210,Tire manufacturing,326,3
326220,Rubber and plastics hoses and belting manufacturing,326,3
326290,Other rubber product manufacturing,326,3
42,WHOLESALE TRADE,TOTII,1
4231,Motor vehicle and motor vehicle parts and supplies,42,2
423100,Motor vehicle and motor vehicle parts and supplies,4231,3
4234,Professional and commercial equipment and supplies,42,2
423400,Professional and commercial equipment and supplies,4234,3
4236,Household appliances and electrical and electronic goods,42,2
423600,Household appliances and electrical and electronic goods,4236,3
4238,"Machinery, equipment, and supplies",42,2
423800,"Machinery, equipment, and supplies",4238,3
423X,Other durable goods merchant wholesalers,42,2
423A00,Other durable goods merchant wholesalers,423X,3
4242,Drugs and druggists' sundries,42,2
424200,Drugs and druggists' sundries,4242,3
4244,Grocery and related product wholesalers,42,2
424400,Grocery and related product wholesalers,4244,3
4247,Petroleum and petroleum products,42,2
424700,Petroleum and petroleum products,4247,3
424X,Other nondurable goods merchant wholesalers,42,2
424A00,Other nondurable goods merchant wholesalers,424X,3
425,Wholesale electronic markets and agents and brokers,42,2
425000,Wholesale electronic markets and agents and brokers,425,3
42ID,Customs duties,42,2
4200ID,Customs duties,42ID,3
44RT,RETAIL TRADE,TOTII,1
441,Motor vehicle and parts dealers,44RT,2
441000,Motor vehicle and parts dealers,441,3
445,Food and beverage stores,44RT,2
445000,Food and beverage stores,445,3
452,General merchandise stores,44RT,2
452000,General merchandise stores,452,3
4A0,Other retail,44RT,2
444,Building material and garden equipment and supplies dealers,4A0,3
444000,Building material and garden equipment and supplies dealers,444,4
446,Health and personal care stores,4A0,3
446000,Health and personal care stores,446,4
447,Gasoline stations,4A0,3
447000,Gasoline stations,447,4
448,Clothing and clothing accessories stores,4A0,3
448000,Clothing and clothing accessories stores,448,4
454,Nonstore retailers,4A0,3
454000,Nonstore retailers,454,4
4A0X,All other retail,4A0,3
4B0000,All other retail,4A0X,4
48TW,"TRANSPORTATION AND WAREHOUSING, EXCLUDING POSTAL SERVICE",TOTII,1
481,Air transportation,48TW,2
481000,Air transportation,481,3
482,Rail transportation,48TW,2
482000,Rail transportation,482,3
483,Water transportation,48TW,2
483000,Water transportation,483,3
484,Truck transportation,48TW,2
484000,Truck transportation,484,3
485,Transit and ground passenger transportation,48TW,2
485000,Transit and ground passenger transportation,485,3
486,Pipeline transportation,48TW,2
486000,Pipeline transportation,486,3
487OS,Other transportation and support activities,48TW,2
48A,Scenic and sightseeing transportation and support activities,487OS,3
48A000,Scenic and sightseeing transportation and support activities,48A,4
492,Couriers and messengers,487OS,3
492000,Couriers and messengers,492,4
493,Warehousing and storage,48TW,2
493000,Warehousing and storage,493,3
51,INFORMATION,TOTII,1
511,"Publishing industries, except internet (includes software)",51,2
5111,"Newspaper, periodical, book, and directory publishers",511,3
511110,Newspaper publishers,5111,4
511120,Periodical publishers,5111,4
511130,Book publishers,5111,4
5111A0,"Directory, mailing list, and other publishers",5111,4
5112,Software publishers,511,3
511200,Software publishers,5112,4
512,Motion picture and sound recording industries,51,2
512100,Motion picture and video industries,512,3
512200,Sound recording industries,512,3
513,Broadcasting and telecommunications,51,2
515,Broadcasting (except Internet),513,3
515100,Radio and television broadcasting,515,4
515200,Cable and other subscription programming,515,4
5171,Wired telecommunications carriers,513,3
517110,Wired telecommunications carriers,5171,4
5172,Wireless telecommunications carriers (except satellite),513,3
517210,Wireless telecommunications carriers (except satellite),5172,4
5174OT,"Other telecommunications, including satellite",513,3
517A00,"Satellite, telecommunications resellers, and all other telecommunications",5174OT,4
514,"Data processing, internet publishing, and other information services",51,2
518,"Data processing, hosting, and related services",514,3
518200,"Data processing, hosting, and related services",518,4
519,Other information services,514,3
519130,Internet publishing and broadcasting and Web search portals,519,4
5191A0,"News syndicates, libraries, archives and all other information services",519,4
52,FINANCE AND INSURANCE,TOTII,1
521CI,"Federal Reserve banks, credit intermediation, and related activities",52,2
52A000,Monetary authorities and depository credit intermediation,521CI,3
522A00,Nondepository credit intermediation and related activities,521CI,3
523,"Securities, commodity contracts, and investments",52,2
523A00,Securities and commodity contracts intermediation and brokerage,523,3
523900,Other financial investment activities,523,3
524,Insurance carriers and related activities,52,2
524113,Direct life insurance carriers,524,3
5241X,"Insurance carriers, except direct life",524,3
5241XX,"Insurance carriers, except direct life",5241X,4
5242,"Agencies, brokerages, and other insurance related activities",524,3
524200,"Insurance agencies, brokerages, and related activities",5242,4
525,"Funds, trusts, and other financial vehicles",52,2
525000,"Funds, trusts, and other financial vehicles",525,3
53,REAL ESTATE AND RENTAL AND LEASING,TOTII,1
HS,Housing,53,2
HSO,Owner-occupied housing,HS,3
531HSO,Owner-occupied housing,HSO,4
HST,Tenant-occupied housing,HS,3
531HST,Tenant-occupied housing,HST,4
ORE,Other real estate,53,2
531ORE,Other real estate,ORE,3
532RL,Rental and leasing services and lessors of intangible assets,53,2
532100,Automotive equipment rental and leasing,532RL,3
532A00,General and consumer goods rental,532RL,3
532400,Commercial and industrial machinery and equipment rental and leasing,532RL,3
533000,Lessors of nonfinancial intangible assets,532RL,3
54,PROFESSIONAL AND TECHNICAL SERVICES,TOTII,1
5411,Legal services,54,2
541100,Legal services,5411,3
5412OP,"Miscellaneous professional, scientific, and technical services",54,2
5412,"Accounting, tax preparation, bookkeeping, and payroll services",5412OP,3
541200,"Accounting, tax preparation, bookkeeping, and payroll services",5412,4
5413,"Architectural, engineering, and related services",5412OP,3
541300,"Architectural, engineering, and related services",5413,4
5416,"Management, scientific, and technical consulting services",5412OP,3
541610,Management consulting services,5416,4
5416A0,Environmental and other technical consulting services,5416,4
5417,Scientific research and development services,5412OP,3
541700,Scientific research and development services,5417,4
5418,"Advertising, public relations, and related services",5412OP,3
541800,"Advertising, public relations, and related services",5418,4
541X,"Specialized design services and other professional, scientific, and technical services",5412OP,3
541400,Specialized design services,541X,4
5419A0,"All other miscellaneous professional, scientific, and technical services",541X,4
541920,Photographic services,541X,4
541940,Veterinary services,541X,4
5415,Computer systems design and related services,54,2
541511,Custom computer programming services,5415,3
541512,Computer systems design services,5415,3
54151A,"Other computer related services, including facilities management",5415,3
55,Management of companies and enterprises,TOTII,1
550000,Management of companies and enterprises,55,2
56,ADMINISTRATIVE AND WASTE SERVICES,TOTII,1
561,Administrative and support services,56,2
5613,Employment services,561,3
561300,Employment services,5613,4
5617,Services to buildings and dwellings,561,3
561700,Services to buildings and dwellings,5617,4
561X,Other administrative and support services,561,3
561100,Office administrative services,561X,4
561200,Facilities support services,561X,4
561400,Business support services,561X,4
561500,Travel arrangement and reservation services,561X,4
561600,Investigation and security services,561X,4
561900,Other support services,561X,4
562,Waste management and remediation services,56,2
