code,name,parent_code,level
562000,Waste management and remediation services,562,3
61,Educational services,TOTII,1
611100,Elementary and secondary schools,61,2
611A00,"Junior colleges, colleges, universities, and professional schools",61,2
611B00,Other educational services,61,2
62,HEALTH CARE AND SOCIAL ASSISTANCE,TOTII,1
621,Ambulatory health care services,62,2
6211,Offices of physicians,621,3
621100,Offices of physicians,6211,4
6212,Offices of dentists,621,3
621200,Offices of dentists,6212,4
6213,Offices of other health practitioners,621,3
621300,Offices of other health practitioners,6213,4
6214,Outpatient care centers,621,3
621400,Outpatient care centers,6214,4
6215OH,Other ambulatory health care services,621,3
621500,Medical and diagnostic laboratories,6215OH,4
621600,Home health care services,6215OH,4
621900,Other ambulatory health care services,6215OH,4
622,Hospitals,62,2
622000,Hospitals,622,3
623,Nursing and residential care facilities,62,2
623A00,Nursing and community care facilities,623,3
623B00,"Residential mental health, substance abuse, and other residential care facilities",623,3
624,Social assistance,62,2
624100,Individual and family services,624,3
624A00,"Community food, housing, and other relief services, including vocational rehabilitation services",624,3
624400,Child day care services,624,3
71,"ARTS, ENTERTAINMENT, AND RECREATION",TOTII,1
711AS,"Performing arts, spectator sports, museums, and related activities",71,2
711100,Performing arts companies,711AS,3
711200,Spectator sports,711AS,3
711A00,Promoters of performing arts and sports and agents for public figures,711AS,3
711500,"Independent artists, writers, and performers",711AS,3
712000,"Museums, historical sites, zoos, and parks",711AS,3
713,"Amusements, gambling, and recreation industries",71,2
713100,Amusement parks and arcades,713,3
713200,Gambling industries (except casino hotels),713,3
713900,Other amusement and recreation industries,713,3
72,ACCOMMODATION AND FOOD SERVICES,TOTII,1
721,Accommodation,72,2
721000,Accommodation,721,3
722,Food services and drinking places,72,2
722110,Full-service restaurants,722,3
722211,Limited-service restaurants,722,3
722A00,All other food and drinking places,722,3
81,"Other services, except government",TOTII,1
811,Repair and maintenance,81,2
811100,Automotive repair and maintenance (including car washes),811,3
811200,Electronic and precision equipment repair and maintenance,811,3
811300,Commercial and industrial machinery and equipment repair and maintenance,811,3
811400,Personal and household goods repair and maintenance,811,3
812,Personal and laundry services,81,2
812100,Personal care services,812,3
812200,Death care services,812,3
812300,Dry-cleaning and laundry services,812,3
812900,Other personal services,812,3
813,"Religious, grantmaking, civic, professional, and similar organizations",81,2
813100,Religious organizations,813,3
813A00,"Grantmaking, giving, and social advocacy organizations",813,3
813B00,"Civic, social, professional, and similar organizations",813,3
814,Private households,81,2
814000,Private households,814,3
G,GOVERNMENT,TOTII,1
GFGD,Federal general government (defense),G,2
S00500,Federal general government (defense),GFGD,3
GFGN,Federal general government (nondefense),G,2
S00600,Federal general government (nondefense),GFGN,3
GFE,Federal government enterprises,G,2
491000,Postal service,GFE,3
S00101,Federal electric utilities,GFE,3
S00102,Other federal government enterprises,GFE,3
GSLG,State and local general government,G,2
GSLGE,State and local government (educational services),GSLG,3
GSLGH,State and local government (hospitals and health services),GSLG,3
GSLGO,State and local government (other services),GSLG,3
GSLE,State and local government enterprises,G,2
S00201,State and local government passenger transit,GSLE,3
S00202,State and local government electric utilities,GSLE,3
S00203,Other state and local government enterprises,GSLE,3
Used,"Scrap, used and secondhand goods",TOTII,1
S004,"Scrap, used and secondhand goods",Used,2
S00401,Scrap,S004,3
S00402,Used and secondhand goods,S004,3
Other,Noncomparable imports and rest-of-the-world adjustment,TOTII,1
S003,Noncomparable imports,Other,2
S00300,Noncomparable imports,S003,3
S009,Rest of the world adjustment,Other,2
S00900,Rest of the world adjustment,S009,3
TOTII,Total,,0
T017,Total industry supply,,0
T005,Total Intermediate use,T008,1
VABAS,Value Added (basic prices),TOTII,1
V001,Compensation of employees,VABAS,2
V00100,Compensation of employees,V001,3
T00OTOP,Other taxes on production,VABAS,2
V003,Gross operating surplus,VABAS,2
V00300,Gross operating surplus,V003,3
V002,"Taxes on production and imports, less subsidies",VABAS,2
V00200,"Taxes on production and imports, less subsidies",V002,3
T008,Total Industry Output,,0
T00TOP,Taxes on products and imports,T00OTOP,3
T00SUB,Less: Subsidies on products,T00OTOP,3

